{"$schema":"https://schemas.nutestserver.dev/extensions/manifest/v1","capabilities":[{"name":"host.clock.read","requirement":"required"},{"name":"network.outbound-http","requirement":"optional"}],"contracts":{"capability":1,"contribution":1,"manifest":1,"operation":1,"route":1,"structural":1},"contributions":[{"id":"Contoso.Flavors.ServiceIndex","kind":"service-resource","version":1}],"id":"Contoso.Flavors","operations":[{"allowReplacement":false,"id":"Contoso.Flavors.GetIndex","ownership":"new","requestContract":"Contoso.Flavors.GetIndexRequest.v1","responseContract":"Contoso.Flavors.GetIndexResponse.v1","version":1}],"publisher":"Contoso","routes":[{"access":"read","head":"mirrors-get","id":"contoso.flavors.index","maximumRequestBytes":0,"maximumResponseBytes":1048576,"methods":["GET","HEAD"],"operationId":"Contoso.Flavors.GetIndex","path":"/flavors/index.json","timeoutMilliseconds":30000}],"schemaVersion":1,"sdk":{"maximumExclusive":"2.0.0","minimum":"1.0.0"},"version":"1.2.3"}