{
  "$schema": "https://schemas.nutestserver.dev/extensions/manifest/v1",
  "schemaVersion": 1,
  "id": "Contoso.Flavors",
  "version": "1.2.3",
  "publisher": "Contoso",
  "sdk": {
    "minimum": "1.0.0",
    "maximumExclusive": "2.0.0"
  },
  "contracts": {
    "manifest": 1,
    "operation": 1,
    "contribution": 1,
    "route": 1,
    "capability": 1,
    "structural": 1
  },
  "operations": [
    {
      "id": "Contoso.Flavors.GetIndex",
      "version": 1,
      "requestContract": "Contoso.Flavors.GetIndexRequest.v1",
      "responseContract": "Contoso.Flavors.GetIndexResponse.v1",
      "ownership": "new",
      "allowReplacement": false
    }
  ],
  "contributions": [
    {
      "id": "Contoso.Flavors.ServiceIndex",
      "kind": "service-resource",
      "version": 1
    }
  ],
  "routes": [
    {
      "id": "contoso.flavors.index",
      "operationId": "Contoso.Flavors.GetIndex",
      "methods": [ "GET", "HEAD" ],
      "path": "/flavors/index.json",
      "access": "read",
      "head": "mirrors-get",
      "maximumRequestBytes": 0,
      "maximumResponseBytes": 1048576,
      "timeoutMilliseconds": 30000
    }
  ],
  "capabilities": [
    {
      "name": "host.clock.read",
      "requirement": "required"
    },
    {
      "name": "network.outbound-http",
      "requirement": "optional"
    }
  ]
}
