{
  "routes": [
    {
      "timeoutMilliseconds": 30000,
      "path": "/flavors/index.json",
      "operationId": "Contoso.Flavors.GetIndex",
      "methods": [ "HEAD", "GET" ],
      "maximumResponseBytes": 1048576,
      "maximumRequestBytes": 0,
      "id": "contoso.flavors.index",
      "head": "mirrors-get",
      "access": "read"
    }
  ],
  "version": "1.2.3",
  "sdk": {
    "maximumExclusive": "2.0.0",
    "minimum": "1.0.0"
  },
  "publisher": "Contoso",
  "operations": [
    {
      "version": 1,
      "responseContract": "Contoso.Flavors.GetIndexResponse.v1",
      "requestContract": "Contoso.Flavors.GetIndexRequest.v1",
      "ownership": "new",
      "id": "Contoso.Flavors.GetIndex",
      "allowReplacement": false
    }
  ],
  "id": "Contoso.Flavors",
  "contributions": [
    {
      "version": 1,
      "kind": "service-resource",
      "id": "Contoso.Flavors.ServiceIndex"
    }
  ],
  "contracts": {
    "structural": 1,
    "route": 1,
    "operation": 1,
    "manifest": 1,
    "contribution": 1,
    "capability": 1
  },
  "capabilities": [
    {
      "requirement": "optional",
      "name": "network.outbound-http"
    },
    {
      "requirement": "required",
      "name": "host.clock.read"
    }
  ],
  "schemaVersion": 1,
  "$schema": "https://schemas.nutestserver.dev/extensions/manifest/v1"
}
